{
  "schema_version": "target-ref-v1",
  "kind": "FILE",
  "observed": {
    "path": "C:\\samples\\fixture.exe"
  },
  "identity_strength": "PARTIAL",
  "verified_digest": {
    "algorithm": "sha256",
    "value": "aaaaaaaaaaaaaaaaaaaaaaaaaaaaaaaaaaaaaaaaaaaaaaaaaaaaaaaaaaaaaaaa"
  },
  "snapshot": {
    "size_bytes": 1024,
    "mtime_ns": 123456789
  },
  "revalidation_required": true
}
